{
  "scenario_id": "restart_denied",
  "tier": 3,
  "tier_name": "Relationship-dependent",
  "action_type": "RestartServerAction",
  "requested_by": "user_123",
  "performed_by": "agent_01",
  "targets": "srv_123",
  "reason": "restart_denied",
  "change_tickets": [],
  "exceptions": [],
  "instructions": []
}
