{
  "scenario_id": "restart_allowed",
  "tier": 3,
  "tier_name": "Relationship-dependent",
  "action_type": "RestartServerAction",
  "requested_by": "user_123",
  "performed_by": "agent_01",
  "targets": "srv_123",
  "reason": "restart_allowed",
  "change_tickets": [
    {
      "id": "CHG_001",
      "status": "Approved"
    }
  ],
  "exceptions": [],
  "instructions": []
}
