{"scenario_id":"restart_break_glass_allowed","tier":6,"tier_name":"Exception/break-glass","action_type":"RestartServerAction","requested_by":"user_123","performed_by":"agent_01","targets":"srv_123","reason":"restart with valid break-glass exception","change_tickets":[],"exceptions":[{"id":"bg_exception_valid","status":"active","type":"BreakGlassException"}],"instructions":[]}
