{
  "scenario_id": "query_logs_with_audit_allowed",
  "tier": 6,
  "tier_name": "Obligation",
  "action_type": "QueryLogsAction",
  "requested_by": "user_123",
  "performed_by": "agent_01",
  "targets": "srv_123",
  "reason": "query_logs_with_audit_allowed",
  "change_tickets": [],
  "exceptions": [],
  "instructions": [],
  "has_audit_obligation": true
}
