{"scenario_id":"query_logs_staging_allowed","tier":2,"tier_name":"Attribute-based","action_type":"QueryLogsAction","requested_by":"user_123","performed_by":"agent_01","targets":"srv_456","reason":"query staging logs","has_audit_obligation":true,"change_tickets":[],"exceptions":[],"instructions":[]}
